{
 "schema": "szk.ma.rob-sync-proposal/v1",
 "tool": "rob2",
 "column": "rob",
 "column_exists": true,
 "changes": [
  {
   "row_uid": "rnfdcoq",
   "row": 0,
   "study_id": "NCT0456",
   "label": "Smith 2010",
   "before": "high",
   "after": "low",
   "judgement": "low",
   "basis": "consensus",
   "source": "04_torzitas_kockazat/appraisals/NCT0456.rob2.o1.consensus.json",
   "files": [
    "04_torzitas_kockazat/appraisals/NCT0456.rob2.o1.consensus.json"
   ],
   "provenance": {
    "method": "calculated",
    "derived_from": "appraisal",
    "tool": "rob2",
    "files": [
     "04_torzitas_kockazat/appraisals/NCT0456.rob2.o1.consensus.json"
    ]
   }
  }
 ],
 "unchanged": 0,
 "unmatched": [
  {
   "row": 1,
   "row_uid": "rwita53",
   "study_id": "NCT0999",
   "label": "Kovács 2019"
  }
 ],
 "conflicts": [],
 "skipped": [],
 "warnings": []
}
